{
  "_notes": [
    "Back to the Future [Data East, 1990]",
    "2026-02-14 added by Tom Collins <tom@scorbit.io>",
    "Adjustments 0x1E00-0x1E42 are protected by a plain 8-bit sum (checksum8_sum, not complemented) at 0x1EDE,",
    "the byte right after the custom-message text, followed by a change counter and the 0xFF fill. This",
    "block runs from 0x1E00 to the byte before the 0xFF fill. Verified against saved bttf_a27 images (both cabinets), one",
    "writer must drop the write rather than repair it.",
    "Adjustments 0x1E00-0x1E42 are protected by a plain 8-bit sum at 0x1EDE; see README.md in maps/dataeast.",
    "The declaration follows bttf_a27 and bttf_g27, whose ROMs sum 0x1E00-0x1E42 and which is the revision confirmed against saved NVRAM. bttf_a28 itself sums one byte more, 0x1E00-0x1E43."
  ],
  "_fileformat": 0.8,
  "_metadata": {
    "version": 10,
    "copyright": [
      "Copyright (C) 2026 by Tom Collins <tom@scorbit.io>"
    ],
    "license": "Open Data Commons Open Database License (ODbL) v1.0",
    "platform": "dataeast",
    "roms": [
      "bttf_a27",
      "bttf_a28",
      "bttf_g27"
    ]
  },
  "game_state": {
    "scores": [
      {
        "label": "Player 1",
        "encoding": "bcd",
        "start": "0x0010",
        "length": 4
      },
      {
        "label": "Player 2",
        "encoding": "bcd",
        "start": "0x0014",
        "length": 4
      },
      {
        "label": "Player 3",
        "encoding": "bcd",
        "start": "0x0018",
        "length": 4
      },
      {
        "label": "Player 4",
        "encoding": "bcd",
        "start": "0x001C",
        "length": 4
      }
    ],
    "credits": {
      "label": "Credits",
      "start": "0x1DE0",
      "encoding": "bcd"
    },
    "free_play": {
      "label": "Free Play",
      "start": "0x1E04",
      "encoding": "bool"
    },
    "max_credits": {
      "label": "Max Credits",
      "start": "0x1E0F",
      "encoding": "bcd"
    },
    "player_count": {
      "label": "Player Count",
      "start": "0x03C8",
      "encoding": "int"
    },
    "ball_count": {
      "label": "Ball Count",
      "start": "0x1E0D",
      "encoding": "bcd"
    },
    "current_player": {
      "label": "Player",
      "start": "0x03C7",
      "encoding": "int"
    },
    "current_ball": {
      "label": "Ball",
      "start": "0x00CA",
      "encoding": "int"
    },
    "game_over": {
      "_notes": "game is over if current player/ball is 0",
      "label": "Game Over",
      "start": "0x03C7",
      "encoding": "bool",
      "invert": true
    }
  },
  "high_scores": [
    {
      "label": "World Record",
      "short_label": "WR",
      "initials": {
        "start": "0x1DCC",
        "encoding": "ch",
        "length": 3
      },
      "score": {
        "encoding": "bcd",
        "start": "0x1DA0",
        "length": 4
      }
    },
    {
      "label": "First",
      "short_label": "#1",
      "initials": {
        "start": "0x1DCF",
        "encoding": "ch",
        "length": 3
      },
      "score": {
        "encoding": "bcd",
        "start": "0x1DA4",
        "length": 4
      }
    },
    {
      "label": "Second",
      "short_label": "#2",
      "initials": {
        "start": "0x1DD2",
        "encoding": "ch",
        "length": 3
      },
      "score": {
        "encoding": "bcd",
        "start": "0x1DA8",
        "length": 4
      }
    },
    {
      "label": "Third",
      "short_label": "#3",
      "initials": {
        "start": "0x1DD5",
        "encoding": "ch",
        "length": 3
      },
      "score": {
        "encoding": "bcd",
        "start": "0x1DAC",
        "length": 4
      }
    },
    {
      "label": "Fourth",
      "short_label": "#4",
      "initials": {
        "start": "0x1DD8",
        "encoding": "ch",
        "length": 3
      },
      "score": {
        "encoding": "bcd",
        "start": "0x1DB0",
        "length": 4
      }
    },
    {
      "label": "Fifth",
      "short_label": "#5",
      "initials": {
        "start": "0x1DDB",
        "encoding": "ch",
        "length": 3
      },
      "score": {
        "encoding": "bcd",
        "start": "0x1DB4",
        "length": 4
      }
    }
  ],
  "checksum8_sum": [
    {
      "label": "Adjustments",
      "start": "0x1E00",
      "end": "0x1E42",
      "checksum": "0x1EDE"
    }
  ]
}
